[
  {
    "source": "beyblade:0:Dragoon S",
    "target": "attack-rings:15",
    "relation": "equips",
    "evidence": "template byte 0x1D falls exactly in confirmed attack-rings ID range",
    "confidence": "strongly_supported"
  },
  {
    "source": "beyblade:0:Dragoon S",
    "target": "weight-disks:5",
    "relation": "equips",
    "evidence": "template byte 0x1E falls exactly in confirmed weight-disks ID range",
    "confidence": "strongly_supported"
  },
  {
    "source": "beyblade:0:Dragoon S",
    "target": "blade-bases:7",
    "relation": "equips",
    "evidence": "template byte 0x20 falls exactly in confirmed blade-bases ID range",
    "confidence": "strongly_supported"
  },
  {
    "source": "beyblade:0:Dragoon S",
    "target": "spin-gears:0",
    "relation": "equips_packed_candidate",
    "evidence": "low six bits fit the 22-entry Spin Gear range; high bits act as flags",
    "confidence": "candidate"
  },
  {
    "source": "beyblade:0:Dragoon S",
    "target": "bit-chip:11",
    "relation": "equips",
    "evidence": "position follows four part IDs and has a distinct 3..70 namespace",
    "confidence": "strongly_supported"
  },
  {
    "source": "beyblade:1:Dragoon G",
    "target": "attack-rings:35",
    "relation": "equips",
    "evidence": "template byte 0x1D falls exactly in confirmed attack-rings ID range",
    "confidence": "strongly_supported"
  },
  {
    "source": "beyblade:1:Dragoon G",
    "target": "weight-disks:8",
    "relation": "equips",
    "evidence": "template byte 0x1E falls exactly in confirmed weight-disks ID range",
    "confidence": "strongly_supported"
  },
  {
    "source": "beyblade:1:Dragoon G",
    "target": "blade-bases:30",
    "relation": "equips",
    "evidence": "template byte 0x20 falls exactly in confirmed blade-bases ID range",
    "confidence": "strongly_supported"
  },
  {
    "source": "beyblade:1:Dragoon G",
    "target": "spin-gears:2",
    "relation": "equips_packed_candidate",
    "evidence": "low six bits fit the 22-entry Spin Gear range; high bits act as flags",
    "confidence": "candidate"
  },
  {
    "source": "beyblade:1:Dragoon G",
    "target": "bit-chip:11",
    "relation": "equips",
    "evidence": "position follows four part IDs and has a distinct 3..70 namespace",
    "confidence": "strongly_supported"
  },
  {
    "source": "beyblade:2:Dragoon V2",
    "target": "attack-rings:44",
    "relation": "equips",
    "evidence": "template byte 0x1D falls exactly in confirmed attack-rings ID range",
    "confidence": "strongly_supported"
  },
  {
    "source": "beyblade:2:Dragoon V2",
    "target": "weight-disks:15",
    "relation": "equips",
    "evidence": "template byte 0x1E falls exactly in confirmed weight-disks ID range",
    "confidence": "strongly_supported"
  },
  {
    "source": "beyblade:2:Dragoon V2",
    "target": "blade-bases:31",
    "relation": "equips",
    "evidence": "template byte 0x20 falls exactly in confirmed blade-bases ID range",
    "confidence": "strongly_supported"
  },
  {
    "source": "beyblade:2:Dragoon V2",
    "target": "spin-gears:1",
    "relation": "equips_packed_candidate",
    "evidence": "low six bits fit the 22-entry Spin Gear range; high bits act as flags",
    "confidence": "candidate"
  },
  {
    "source": "beyblade:2:Dragoon V2",
    "target": "bit-chip:11",
    "relation": "equips",
    "evidence": "position follows four part IDs and has a distinct 3..70 namespace",
    "confidence": "strongly_supported"
  },
  {
    "source": "beyblade:3:Dragoon Storm",
    "target": "attack-rings:15",
    "relation": "equips",
    "evidence": "template byte 0x1D falls exactly in confirmed attack-rings ID range",
    "confidence": "strongly_supported"
  },
  {
    "source": "beyblade:3:Dragoon Storm",
    "target": "weight-disks:5",
    "relation": "equips",
    "evidence": "template byte 0x1E falls exactly in confirmed weight-disks ID range",
    "confidence": "strongly_supported"
  },
  {
    "source": "beyblade:3:Dragoon Storm",
    "target": "blade-bases:7",
    "relation": "equips",
    "evidence": "template byte 0x20 falls exactly in confirmed blade-bases ID range",
    "confidence": "strongly_supported"
  },
  {
    "source": "beyblade:3:Dragoon Storm",
    "target": "spin-gears:0",
    "relation": "equips_packed_candidate",
    "evidence": "low six bits fit the 22-entry Spin Gear range; high bits act as flags",
    "confidence": "candidate"
  },
  {
    "source": "beyblade:3:Dragoon Storm",
    "target": "bit-chip:11",
    "relation": "equips",
    "evidence": "position follows four part IDs and has a distinct 3..70 namespace",
    "confidence": "strongly_supported"
  },
  {
    "source": "beyblade:4:Dragoon Fighter",
    "target": "attack-rings:31",
    "relation": "equips",
    "evidence": "template byte 0x1D falls exactly in confirmed attack-rings ID range",
    "confidence": "strongly_supported"
  },
  {
    "source": "beyblade:4:Dragoon Fighter",
    "target": "weight-disks:5",
    "relation": "equips",
    "evidence": "template byte 0x1E falls exactly in confirmed weight-disks ID range",
    "confidence": "strongly_supported"
  },
  {
    "source": "beyblade:4:Dragoon Fighter",
    "target": "blade-bases:19",
    "relation": "equips",
    "evidence": "template byte 0x20 falls exactly in confirmed blade-bases ID range",
    "confidence": "strongly_supported"
  },
  {
    "source": "beyblade:4:Dragoon Fighter",
    "target": "spin-gears:0",
    "relation": "equips_packed_candidate",
    "evidence": "low six bits fit the 22-entry Spin Gear range; high bits act as flags",
    "confidence": "candidate"
  },
  {
    "source": "beyblade:4:Dragoon Fighter",
    "target": "bit-chip:11",
    "relation": "equips",
    "evidence": "position follows four part IDs and has a distinct 3..70 namespace",
    "confidence": "strongly_supported"
  },
  {
    "source": "beyblade:5:Strata Dragoon G",
    "target": "attack-rings:45",
    "relation": "equips",
    "evidence": "template byte 0x1D falls exactly in confirmed attack-rings ID range",
    "confidence": "strongly_supported"
  },
  {
    "source": "beyblade:5:Strata Dragoon G",
    "target": "weight-disks:7",
    "relation": "equips",
    "evidence": "template byte 0x1E falls exactly in confirmed weight-disks ID range",
    "confidence": "strongly_supported"
  },
  {
    "source": "beyblade:5:Strata Dragoon G",
    "target": "blade-bases:32",
    "relation": "equips",
    "evidence": "template byte 0x20 falls exactly in confirmed blade-bases ID range",
    "confidence": "strongly_supported"
  },
  {
    "source": "beyblade:5:Strata Dragoon G",
    "target": "spin-gears:4",
    "relation": "equips_packed_candidate",
    "evidence": "low six bits fit the 22-entry Spin Gear range; high bits act as flags",
    "confidence": "candidate"
  },
  {
    "source": "beyblade:5:Strata Dragoon G",
    "target": "bit-chip:39",
    "relation": "equips",
    "evidence": "position follows four part IDs and has a distinct 3..70 namespace",
    "confidence": "strongly_supported"
  },
  {
    "source": "beyblade:6:Master Dragoon",
    "target": "attack-rings:20",
    "relation": "equips",
    "evidence": "template byte 0x1D falls exactly in confirmed attack-rings ID range",
    "confidence": "strongly_supported"
  },
  {
    "source": "beyblade:6:Master Dragoon",
    "target": "weight-disks:4",
    "relation": "equips",
    "evidence": "template byte 0x1E falls exactly in confirmed weight-disks ID range",
    "confidence": "strongly_supported"
  },
  {
    "source": "beyblade:6:Master Dragoon",
    "target": "blade-bases:12",
    "relation": "equips",
    "evidence": "template byte 0x20 falls exactly in confirmed blade-bases ID range",
    "confidence": "strongly_supported"
  },
  {
    "source": "beyblade:6:Master Dragoon",
    "target": "spin-gears:0",
    "relation": "equips_packed_candidate",
    "evidence": "low six bits fit the 22-entry Spin Gear range; high bits act as flags",
    "confidence": "candidate"
  },
  {
    "source": "beyblade:6:Master Dragoon",
    "target": "bit-chip:31",
    "relation": "equips",
    "evidence": "position follows four part IDs and has a distinct 3..70 namespace",
    "confidence": "strongly_supported"
  },
  {
    "source": "beyblade:7:Kids Dragoon",
    "target": "attack-rings:0",
    "relation": "equips",
    "evidence": "template byte 0x1D falls exactly in confirmed attack-rings ID range",
    "confidence": "strongly_supported"
  },
  {
    "source": "beyblade:7:Kids Dragoon",
    "target": "weight-disks:9",
    "relation": "equips",
    "evidence": "template byte 0x1E falls exactly in confirmed weight-disks ID range",
    "confidence": "strongly_supported"
  },
  {
    "source": "beyblade:7:Kids Dragoon",
    "target": "blade-bases:0",
    "relation": "equips",
    "evidence": "template byte 0x20 falls exactly in confirmed blade-bases ID range",
    "confidence": "strongly_supported"
  },
  {
    "source": "beyblade:7:Kids Dragoon",
    "target": "spin-gears:0",
    "relation": "equips_packed_candidate",
    "evidence": "low six bits fit the 22-entry Spin Gear range; high bits act as flags",
    "confidence": "candidate"
  },
  {
    "source": "beyblade:7:Kids Dragoon",
    "target": "bit-chip:19",
    "relation": "equips",
    "evidence": "position follows four part IDs and has a distinct 3..70 namespace",
    "confidence": "strongly_supported"
  },
  {
    "source": "beyblade:8:Dragoon Galaxy Turbo",
    "target": "attack-rings:47",
    "relation": "equips",
    "evidence": "template byte 0x1D falls exactly in confirmed attack-rings ID range",
    "confidence": "strongly_supported"
  },
  {
    "source": "beyblade:8:Dragoon Galaxy Turbo",
    "target": "weight-disks:8",
    "relation": "equips",
    "evidence": "template byte 0x1E falls exactly in confirmed weight-disks ID range",
    "confidence": "strongly_supported"
  },
  {
    "source": "beyblade:8:Dragoon Galaxy Turbo",
    "target": "blade-bases:33",
    "relation": "equips",